{
  "schema": "urn:fdp:schema:gt-failure-table:v1",
  "source": {
    "dataset": "MetroPT-3 (UCI 791)",
    "doi": "10.24432/C5VW3R",
    "license": "CC-BY-4.0",
    "csv_sha256": "db30ccb4ea402e3c8bf2c99db06e288d4f2a772f6928f9dbe26a920d69793e24",
    "resolved_from": "docs/dataset.md#how-the-windows-were-resolved"
  },
  "clock": "utc-assumed",
  "failures": [
    {
      "id": "F1",
      "uci_nr": "#1",
      "start": "2020-04-18T00:00:00.000Z",
      "end": "2020-04-19T02:00:00.000Z",
      "uci_start": "2020-04-18T00:00:00.000Z",
      "uci_end": "2020-04-18T23:59:00.000Z",
      "data_onset": "2020-04-18T00:23:59.000Z",
      "data_recovery": "2020-04-19T01:55:36.000Z",
      "onset_known": false,
      "precursor_from": null,
      "report_local": "2020-04-18 07:05",
      "maintenance": null,
      "maintenance_verified": false,
      "fault_id": "dryer_purge_leak",
      "accepted_fault_ids": [
        "dryer_purge_leak",
        "downstream_air_leak"
      ],
      "signature": "A",
      "component": "pneumatic panel (dryer/drain side)",
      "native_alarm_first": null,
      "in_headline": true,
      "notes": "The logger was frozen from 17 April 09:20 until 18 April 00:18, so the true onset is unknown and every lead time for this failure is a lower bound. The published end is a whole-day placeholder; the stuck-loaded run continues until 01:56 on 19 April and the repair venting follows from 02:13 to 02:47. No maintenance note exists for it."
    },
    {
      "id": "F2",
      "uci_nr": "#1 (duplicate, read as #2)",
      "start": "2020-05-29T23:30:00.000Z",
      "end": "2020-05-30T06:00:00.000Z",
      "uci_start": "2020-05-29T23:30:00.000Z",
      "uci_end": "2020-05-30T06:00:00.000Z",
      "data_onset": "2020-05-29T23:14:56.000Z",
      "data_recovery": "2020-05-30T05:56:46.000Z",
      "onset_known": true,
      "precursor_from": null,
      "report_local": "2020-05-30 01:10",
      "maintenance": "2020-05-30T12:00:00.000Z",
      "maintenance_verified": false,
      "fault_id": "dryer_purge_leak",
      "accepted_fault_ids": [
        "dryer_purge_leak",
        "downstream_air_leak"
      ],
      "signature": "A",
      "component": "pneumatic panel (dryer/drain side)",
      "native_alarm_first": null,
      "in_headline": true,
      "notes": "The published table repeats the number of the first row; read it as the second. The maintenance note names April, which is a typed month for 30 May, and the data shows no intervention at the recorded hour, so the time is reported rather than verified."
    },
    {
      "id": "F3",
      "uci_nr": "#3",
      "start": "2020-06-05T10:00:00.000Z",
      "end": "2020-06-07T14:30:00.000Z",
      "uci_start": "2020-06-05T10:00:00.000Z",
      "uci_end": "2020-06-07T14:30:00.000Z",
      "data_onset": "2020-06-05T09:48:30.000Z",
      "data_recovery": "2020-06-08T13:54:18.000Z",
      "onset_known": true,
      "precursor_from": null,
      "report_local": "2020-06-05 18:00",
      "maintenance": "2020-06-08T16:00:00.000Z",
      "maintenance_verified": false,
      "fault_id": "dryer_purge_leak",
      "accepted_fault_ids": [
        "dryer_purge_leak",
        "downstream_air_leak"
      ],
      "signature": "A",
      "component": "pneumatic panel (dryer/drain side)",
      "native_alarm_first": "2020-06-06T19:42:19.000Z",
      "in_headline": true,
      "notes": "The published end is when logging stopped, not when the leak ended. The unit was still loaded when logging resumed on 8 June and normal cycling returns at 13:54, before the maintenance note at 16:00, so that note is not verified; the repair period in between is an excluded window."
    },
    {
      "id": "F4",
      "uci_nr": "#4",
      "start": "2020-07-15T14:30:00.000Z",
      "end": "2020-07-15T19:00:00.000Z",
      "uci_start": "2020-07-15T14:30:00.000Z",
      "uci_end": "2020-07-15T19:00:00.000Z",
      "data_onset": "2020-07-15T14:25:23.000Z",
      "data_recovery": "2020-07-15T18:52:54.000Z",
      "onset_known": true,
      "precursor_from": "2020-07-14T21:28:00.000Z",
      "report_local": "2020-07-15 18:25",
      "maintenance": "2020-07-16T00:00:00.000Z",
      "maintenance_verified": true,
      "fault_id": "downstream_air_leak",
      "accepted_fault_ids": [
        "downstream_air_leak"
      ],
      "signature": "B",
      "component": "pneumatic panel (downstream/clients side)",
      "native_alarm_first": "2020-07-15T17:20:11.000Z",
      "in_headline": true,
      "notes": "The window covers the acute phase only. The fast decay of this signature is measurable from 14 July 21:28, and the decay rate normalises at exactly the maintenance hour, which is what verifies the note."
    },
    {
      "id": "F4b",
      "uci_nr": null,
      "start": "2020-07-16T20:00:00.000Z",
      "end": "2020-07-17T06:00:00.000Z",
      "uci_start": null,
      "uci_end": null,
      "data_onset": "2020-07-17T00:54:00.000Z",
      "data_recovery": "2020-07-17T05:35:00.000Z",
      "onset_known": true,
      "precursor_from": null,
      "report_local": "2020-07-17 05:46",
      "maintenance": null,
      "maintenance_verified": false,
      "fault_id": "downstream_air_leak",
      "accepted_fault_ids": [
        "downstream_air_leak"
      ],
      "signature": "B",
      "component": "pneumatic panel (downstream/clients side)",
      "native_alarm_first": "2020-07-17T00:56:00.000Z",
      "in_headline": false,
      "notes": "A recurrence the thesis reports and the published table does not carry, twenty hours after the maintenance of the preceding failure. It counts as a secondary positive or as an excluded window, never as a false positive."
    }
  ],
  "unlabelled_episodes": [
    {
      "start": "2020-03-06T21:42:25.000Z",
      "end": "2020-03-06T22:59:53.000Z",
      "hours": 1.29,
      "tp3_median": 9.326,
      "dv_pressure_median": 0.614,
      "oil_max": 76.65,
      "fault_id_hint": "dryer_purge_leak",
      "note": "A short stuck-loaded episode with raised purge pressure, of the same kind as the labelled failures and never reported."
    },
    {
      "start": "2020-03-11T05:15:20.000Z",
      "end": "2020-03-11T06:10:11.000Z",
      "hours": 0.92,
      "tp3_median": 8.71,
      "dv_pressure_median": 0.872,
      "oil_max": 75.6,
      "fault_id_hint": "dryer_purge_leak",
      "note": "A short stuck-loaded episode with raised purge pressure, of the same kind as the labelled failures and never reported."
    },
    {
      "start": "2020-03-12T00:16:06.000Z",
      "end": "2020-03-12T11:49:50.000Z",
      "hours": 11.56,
      "tp3_median": 9.542,
      "dv_pressure_median": 0.776,
      "oil_max": 78.03,
      "fault_id_hint": "dryer_purge_leak",
      "note": "The thesis records a strange-noise report at 08:25 on the same day."
    },
    {
      "start": "2020-03-26T04:00:30.000Z",
      "end": "2020-03-26T04:52:52.000Z",
      "hours": 0.88,
      "tp3_median": 9.111,
      "dv_pressure_median": 0.712,
      "oil_max": 74.75,
      "fault_id_hint": "dryer_purge_leak",
      "note": "A short stuck-loaded episode with raised purge pressure, of the same kind as the labelled failures and never reported."
    },
    {
      "start": "2020-03-27T07:12:10.000Z",
      "end": "2020-03-27T11:38:11.000Z",
      "hours": 4.44,
      "tp3_median": 9.198,
      "dv_pressure_median": 0.642,
      "oil_max": 77.83,
      "fault_id_hint": "dryer_purge_leak",
      "note": "The thesis lists a report on this day without any detail."
    },
    {
      "start": "2020-03-28T07:22:24.000Z",
      "end": "2020-03-30T07:41:06.000Z",
      "hours": 48.31,
      "tp3_median": 8.634,
      "dv_pressure_median": 0.704,
      "oil_max": 83.12,
      "fault_id_hint": "dryer_purge_leak",
      "note": "A vent from 23:05 to 23:28 on 28 March; never reported."
    },
    {
      "start": "2020-04-12T11:50:31.000Z",
      "end": "2020-04-12T23:36:00.000Z",
      "hours": 11.76,
      "tp3_median": 9.44,
      "dv_pressure_median": 1.804,
      "oil_max": 76.3,
      "fault_id_hint": "dryer_purge_leak",
      "note": "Six days before the first labelled failure."
    },
    {
      "start": "2020-05-13T13:44:04.000Z",
      "end": "2020-05-14T04:36:21.000Z",
      "hours": 14.87,
      "tp3_median": 7.55,
      "dv_pressure_median": 2.426,
      "oil_max": 71.12,
      "fault_id_hint": "dryer_purge_leak",
      "note": "Sixteen days before the second labelled failure."
    },
    {
      "start": "2020-05-19T10:05:50.000Z",
      "end": "2020-05-19T10:51:45.000Z",
      "hours": 0.77,
      "tp3_median": 9.624,
      "dv_pressure_median": 1.476,
      "oil_max": 78.03,
      "fault_id_hint": "dryer_purge_leak",
      "note": "A short stuck-loaded episode with raised purge pressure, of the same kind as the labelled failures and never reported."
    },
    {
      "start": "2020-05-19T22:22:17.000Z",
      "end": "2020-05-20T23:02:33.000Z",
      "hours": 24.67,
      "tp3_median": 7.898,
      "dv_pressure_median": 2.062,
      "oil_max": 76.1,
      "fault_id_hint": "dryer_purge_leak",
      "note": "Ten days before the second labelled failure."
    },
    {
      "start": "2020-06-01T14:49:54.000Z",
      "end": "2020-06-01T15:39:08.000Z",
      "hours": 0.82,
      "tp3_median": 9.864,
      "dv_pressure_median": 1.504,
      "oil_max": 79.7,
      "fault_id_hint": "dryer_purge_leak",
      "note": "A short stuck-loaded episode with raised purge pressure, of the same kind as the labelled failures and never reported."
    },
    {
      "start": "2020-06-03T10:06:00.000Z",
      "end": "2020-06-03T11:08:49.000Z",
      "hours": 1.05,
      "tp3_median": 9.152,
      "dv_pressure_median": 1.78,
      "oil_max": 78.35,
      "fault_id_hint": "dryer_purge_leak",
      "note": "A short stuck-loaded episode with raised purge pressure, of the same kind as the labelled failures and never reported."
    }
  ],
  "excluded_windows": [
    {
      "from": "2020-03-06T21:42:25.000Z",